{
  "$schema": "https://json-schema.org/draft/2020-12/schema",
  "title": "TrackSessionTimer GPS track definition",
  "type": "object",
  "additionalProperties": false,
  "required": [
    "schema_version",
    "revision",
    "track_id",
    "name",
    "country",
    "provenance",
    "reference",
    "geofence",
    "gates",
    "timing",
    "sectors"
  ],
  "properties": {
    "schema_version": {
      "const": 4
    },
    "revision": {
      "type": "integer",
      "minimum": 1,
      "maximum": 4294967295
    },
    "track_id": {
      "type": "string",
      "minLength": 1,
      "maxLength": 47,
      "pattern": "^[A-Za-z0-9._-]+$"
    },
    "name": {
      "type": "string",
      "minLength": 1,
      "maxLength": 63,
      "pattern": ".*\\S.*"
    },
    "country": {
      "type": "string",
      "minLength": 2,
      "maxLength": 3,
      "pattern": "^[A-Z]{2,3}$"
    },
    "provenance": {
      "$ref": "#/$defs/provenance"
    },
    "reference": {
      "$ref": "#/$defs/point"
    },
    "geofence": {
      "type": "object",
      "additionalProperties": false,
      "required": [
        "center_lat_deg",
        "center_lon_deg",
        "radius_m"
      ],
      "properties": {
        "center_lat_deg": {
          "type": "number",
          "minimum": -90,
          "maximum": 90
        },
        "center_lon_deg": {
          "type": "number",
          "minimum": -180,
          "maximum": 180
        },
        "radius_m": {
          "type": "number",
          "exclusiveMinimum": 0,
          "maximum": 25000
        }
      }
    },
    "gates": {
      "type": "object",
      "additionalProperties": false,
      "required": [
        "start",
        "finish"
      ],
      "properties": {
        "start": {
          "$ref": "#/$defs/directed_gate"
        },
        "finish": {
          "$ref": "#/$defs/directed_gate"
        }
      }
    },
    "timing": {
      "type": "object",
      "additionalProperties": false,
      "required": [
        "minimum_lap_time_s"
      ],
      "properties": {
        "minimum_lap_time_s": {
          "type": "number",
          "exclusiveMinimum": 0,
          "maximum": 3600
        }
      }
    },
    "sectors": {
      "type": "array",
      "maxItems": 16,
      "items": {
        "$ref": "#/$defs/sector"
      }
    }
  },
  "$defs": {
    "provenance": {
      "type": "object",
      "additionalProperties": false,
      "required": [
        "source",
        "license",
        "verified_utc",
        "geometry_status"
      ],
      "properties": {
        "source": {
          "type": "string",
          "minLength": 1,
          "maxLength": 127,
          "pattern": ".*\\S.*"
        },
        "license": {
          "type": "string",
          "minLength": 1,
          "maxLength": 47,
          "pattern": ".*\\S.*"
        },
        "verified_utc": {
          "type": "string",
          "minLength": 20,
          "maxLength": 31,
          "format": "date-time"
        },
        "geometry_status": {
          "type": "string",
          "enum": [
            "provisional",
            "device_captured",
            "independently_validated",
            "physically_validated"
          ]
        }
      }
    },
    "sector": {
      "type": "object",
      "additionalProperties": false,
      "required": [
        "sector_id",
        "name",
        "gate"
      ],
      "properties": {
        "sector_id": {
          "type": "string",
          "minLength": 1,
          "maxLength": 31,
          "pattern": "^[A-Za-z0-9._-]+$"
        },
        "name": {
          "type": "string",
          "minLength": 1,
          "maxLength": 47,
          "pattern": ".*\\S.*"
        },
        "gate": {
          "$ref": "#/$defs/directed_gate"
        }
      }
    },
    "point": {
      "type": "object",
      "additionalProperties": false,
      "required": [
        "lat_deg",
        "lon_deg"
      ],
      "properties": {
        "lat_deg": {
          "type": "number",
          "minimum": -90,
          "maximum": 90
        },
        "lon_deg": {
          "type": "number",
          "minimum": -180,
          "maximum": 180
        }
      }
    },
    "directed_gate": {
      "type": "object",
      "additionalProperties": false,
      "required": [
        "left",
        "right",
        "direction_heading_deg",
        "heading_tolerance_deg",
        "minimum_crossing_speed_mps",
        "rearm_corridor_m"
      ],
      "properties": {
        "left": {
          "$ref": "#/$defs/point"
        },
        "right": {
          "$ref": "#/$defs/point"
        },
        "direction_heading_deg": {
          "type": "number",
          "minimum": 0,
          "exclusiveMaximum": 360
        },
        "heading_tolerance_deg": {
          "type": "number",
          "minimum": 0,
          "maximum": 180
        },
        "minimum_crossing_speed_mps": {
          "type": "number",
          "exclusiveMinimum": 0,
          "maximum": 150
        },
        "rearm_corridor_m": {
          "type": "number",
          "exclusiveMinimum": 0,
          "maximum": 1000
        }
      }
    }
  }
}
