{
  "schema_version": 4,
  "revision": 1,
  "track_id": "synthetic_test_loop",
  "name": "Synthetic Test Loop",
  "country": "XX",
  "provenance": {
    "source": "TrackSessionTimer synthetic test data",
    "license": "CC0-1.0",
    "verified_utc": "2026-08-14T00:00:00Z",
    "geometry_status": "physically_validated"
  },
  "reference": {
    "lat_deg": 52.0,
    "lon_deg": -1.0
  },
  "geofence": {
    "center_lat_deg": 52.0,
    "center_lon_deg": -1.0,
    "radius_m": 2000
  },
  "gates": {
    "start": {
      "left": {
        "lat_deg": 52.00005,
        "lon_deg": -1.00002
      },
      "right": {
        "lat_deg": 51.99995,
        "lon_deg": -0.99998
      },
      "direction_heading_deg": 90.0,
      "heading_tolerance_deg": 60.0,
      "minimum_crossing_speed_mps": 2.0,
      "rearm_corridor_m": 15.0
    },
    "finish": {
      "left": {
        "lat_deg": 52.00005,
        "lon_deg": -1.00002
      },
      "right": {
        "lat_deg": 51.99995,
        "lon_deg": -0.99998
      },
      "direction_heading_deg": 90.0,
      "heading_tolerance_deg": 60.0,
      "minimum_crossing_speed_mps": 2.0,
      "rearm_corridor_m": 15.0
    }
  },
  "timing": {
    "minimum_lap_time_s": 20.0
  },
  "sectors": [
    {
      "sector_id": "sector_1",
      "name": "Synthetic Sector 1",
      "gate": {
        "left": {
          "lat_deg": 52.00005,
          "lon_deg": -0.99952
        },
        "right": {
          "lat_deg": 51.99995,
          "lon_deg": -0.99948
        },
        "direction_heading_deg": 90.0,
        "heading_tolerance_deg": 60.0,
        "minimum_crossing_speed_mps": 2.0,
        "rearm_corridor_m": 15.0
      }
    }
  ]
}
